{"$schema":"https://json-schema.org/draft/2020-12/schema","title":"DIAN115 trusted extension v3","type":"object","required":["schema_version","id","name","version"],"properties":{"schema_version":{"const":3},"id":{"type":"string","pattern":"^[a-z0-9]+(?:[.-][a-z0-9]+)*$","maxLength":128},"name":{"type":"string","minLength":1},"version":{"type":"string","minLength":1},"description":{"type":"string"},"author":{"type":"string"},"ui":{"type":"object","required":["entry"],"properties":{"entry":{"type":"string","pattern":"\\.(js|html)$"}}},"jobs":{"type":"array","items":{"type":"object","required":["id","entry"],"properties":{"id":{"type":"string","pattern":"^[a-z0-9]+(?:[.-][a-z0-9]+)*$"},"entry":{"type":"string"},"handler":{"type":"string"},"recover":{"type":"string"},"default_schedule":{"type":"string"},"interval_seconds":{"type":"integer","minimum":0,"maximum":31536000},"timeout_seconds":{"type":"integer","minimum":0,"maximum":31536000},"allow_overlap":{"type":"boolean"},"title":{"type":"string","maxLength":40,"description":"任务在宿主任务队列中的名称，显示为“插件名：标题”；省略时使用任务 ID"},"queue":{"type":"boolean","description":"false 时不在宿主任务队列页面显示；默认 true"},"daemon":{"type":"boolean","description":"插件启用期间持续运行，开机自启、异常自动重启；不能设置定时或超时"}}}},"events":{"type":"array","items":{"type":"object","required":["event","job"],"properties":{"event":{"enum":["message","callback","host","account_message"]},"job":{"type":"string"},"commands":{"type":"array","items":{"type":"string"}},"prefixes":{"type":"array","items":{"type":"string"}},"types":{"type":"array","items":{"type":"string"},"description":"host 事件类型；末尾 * 前缀匹配，* 全部"},"keywords":{"type":"array","items":{"type":"string"},"maxItems":32,"description":"不区分大小写的包含匹配；需要已授权的渠道权限"},"patterns":{"type":"array","items":{"type":"string"},"maxItems":32,"description":"RE2 正则；需要已授权的渠道权限"},"channels":{"type":"array","items":{"enum":["telegram","wecom"]},"description":"message 事件只接收这些渠道；省略为全部"},"peer_types":{"type":"array","items":{"enum":["private","group","channel"]},"description":"account_message 只接收这些会话类型"},"include_outgoing":{"type":"boolean","description":"account_message 是否包含账号自己发出的消息；默认 false"},"all":{"type":"boolean","description":"account_message 接收全部消息"}}}},"declared_usage":{"type":"object"},"icon":{"type":"string","pattern":"\\.(svg|png|webp)$"},"homepage":{"type":"string"},"requires":{"type":"object","properties":{"api":{"type":"string","description":"最低宿主插件 API 版本，例如 3.1"}}},"menu":{"type":"object","properties":{"title":{"type":"string"},"order":{"type":"integer"}},"description":"在侧栏资源分组显示页面入口；需要 ui"},"settings":{"type":"array","items":{"type":"object","required":["key","label","type"],"properties":{"key":{"type":"string"},"label":{"type":"string"},"type":{"enum":["text","password","textarea","number","boolean","select","path","url"]},"default":{},"options":{"type":"array","items":{"type":"object","required":["label","value"],"properties":{"label":{"type":"string"},"value":{"type":["string","number"]}}}},"required":{"type":"boolean"},"help":{"type":"string"},"placeholder":{"type":"string"}}}},"http":{"type":"object","required":["entry"],"properties":{"entry":{"type":"string"},"handler":{"type":"string","default":"handle"},"timeout_seconds":{"type":"integer","minimum":0,"maximum":3600},"public":{"type":"boolean"}}},"listeners":{"type":"array","items":{"type":"object","required":["id","port"],"properties":{"id":{"type":"string","pattern":"^[a-z0-9]+(?:[.-][a-z0-9]+)*$"},"port":{"type":"integer","minimum":1,"maximum":65535},"host":{"type":"string"}}}},"permissions":{"type":"array","uniqueItems":true,"items":{"enum":["telegram.bot","wecom","telegram.account", "network.tcp"]},"description":"申请的消息渠道权限；用户在插件中心逐项授权，默认关闭"}},"anyOf":[{"required":["ui"]},{"required":["jobs"],"properties":{"jobs":{"minItems":1}}}]}