{"schema_version":3,"id":"example.api-lab","name":"插件 API 测试台","version":"3.1.0","description":"测试网络、二进制下载、凭据、CookieCloud、存储、文件、监听、宿主事件、Webhook、任务及通知；站点地址在安装后填写。","ui":{"entry":"ui/page.js"},"jobs":[{"id":"probe","entry":"jobs/job.js","handler":"run","recover":"recover","timeout_seconds":1800},{"id":"on-event","entry":"jobs/events.js","handler":"run","allow_overlap":true,"timeout_seconds":60}],"declared_usage":{"apis":["GET /api/dashboard/stats"],"sites":["用户配置的 HTTP/HTTPS 站点","用户配置的 FlareSolverr"],"files":["插件 data/files 内的 probe.txt","用户显式填写的监听或 CD2 路径"],"notifications":true,"risk":"可读写插件数据；点击对应按钮时才执行登录、通知、下载、监听端口；公开回调需令牌"},"requires":{"api":"3.1"},"icon":"ui/icon.svg","menu":{"title":"插件 API 测试台","order":90},"settings":[{"key":"hook_token","label":"公开回调令牌","type":"password","help":"公开回调需带 ?token= 此值"},{"key":"listen_port","label":"测试监听端口","type":"number","default":18765}],"http":{"entry":"jobs/http.js","public":true},"events":[{"event":"host","job":"on-event","types":["library_organize_*","strm_generate"]}]}
